{
  "schema_version": 1,
  "run_id": "20260926T162925Z-master01-11802cee",
  "created_at": "2026-09-26T16:29:25Z",
  "code": {
    "commit": "a4b1a4e8f1b27dfb8c107967c138942f1b1e6dc6",
    "dirty": false
  },
  "host_id": "master01",
  "environment": {
    "versions": {
      "os": "Ubuntu 24.04.4 LTS kernel 6.14.0-27-generic",
      "ros": "jazzy 7.1.11-1noble.20260615.133206",
      "rmw": "rmw_fastrtps_cpp 8.4.4-1noble.20260615.124621",
      "isaac_sim": "5.1.0-rc.19",
      "gpu_driver": "NVIDIA GeForce RTX 5080 Laptop GPU, 580.173.02",
      "cuda": "13.0"
    },
    "fingerprints": {
      "config": {
        "sha256": "39a45a3bf0becdcb12fd7e0286b2a4921fa0f6333604847e70c0ff3371a7a89f"
      },
      "scene": {
        "sha256": "8c144b9b85b1967ee946eb827a117a96be8b8270e026463f1910f1e79744bba0"
      },
      "model": {
        "not_applicable": "학습 모델을 쓰지 않았다. 판독은 OpenCV QR, 집기 좌표는 시뮬 센서다."
      },
      "dataset": {
        "not_applicable": "학습 · 평가 데이터셋을 쓰지 않았다."
      }
    }
  },
  "clocks": {
    "duration": "simulation",
    "timeout": "monotonic"
  },
  "seed": 7,
  "repetition_index": 2,
  "protocol": {
    "path": "experiments/protocols/hospital-full-acceptance-v1.json",
    "sha256": "6cbd564a73388ba930ba3f72a38470e16ba4cf7a65eefde0b15f4af8854b286a"
  },
  "phase": "acceptance",
  "outcome": "succeeded",
  "artifacts": [
    {
      "uri": "sha256/39a45a3bf0becdcb12fd7e0286b2a4921fa0f6333604847e70c0ff3371a7a89f/deployment.json",
      "sha256": "39a45a3bf0becdcb12fd7e0286b2a4921fa0f6333604847e70c0ff3371a7a89f",
      "size_bytes": 3211
    },
    {
      "uri": "sha256/484d55f88fdbda67db260b204a4195632d37266527e1e628920c949e92683b56/screen.mp4",
      "sha256": "484d55f88fdbda67db260b204a4195632d37266527e1e628920c949e92683b56",
      "size_bytes": 60325644
    },
    {
      "uri": "sha256/8abe74cd4f983043fcfa9ed250fc246a7ecd945d3bd25ed2f06a53767b06c4bb/SUMMARY.txt",
      "sha256": "8abe74cd4f983043fcfa9ed250fc246a7ecd945d3bd25ed2f06a53767b06c4bb",
      "size_bytes": 307
    },
    {
      "uri": "sha256/3112bd74d2593a2a16d11f786713d8bca6dea22c871c9fa52f141356b918e782/tally.txt",
      "sha256": "3112bd74d2593a2a16d11f786713d8bca6dea22c871c9fa52f141356b918e782",
      "size_bytes": 1383
    },
    {
      "uri": "sha256/80d4a3f88a183ab12c133794977c5a57ce2ab11364ea5261cf4c97b023f40141/versions.txt",
      "sha256": "80d4a3f88a183ab12c133794977c5a57ce2ab11364ea5261cf4c97b023f40141",
      "size_bytes": 1032
    },
    {
      "uri": "sha256/7503273a6dd4ce50971ef956258ccbc0724bf7bc0bb2839195c9872431217eb0/web.mkv",
      "sha256": "7503273a6dd4ce50971ef956258ccbc0724bf7bc0bb2839195c9872431217eb0",
      "size_bytes": 55779726
    }
  ],
  "metrics": [
    {
      "name": "attempt_success",
      "value": 1,
      "unit": "ratio",
      "sample_count": 1,
      "missing_count": 0
    },
    {
      "name": "scene_workcell_ready",
      "value": 1,
      "unit": "ratio",
      "sample_count": 1,
      "missing_count": 0
    },
    {
      "name": "scene_refill_both",
      "value": 1,
      "unit": "ratio",
      "sample_count": 1,
      "missing_count": 0
    },
    {
      "name": "scene_container_qr",
      "value": 1,
      "unit": "ratio",
      "sample_count": 1,
      "missing_count": 0
    },
    {
      "name": "pouch_to_end_s",
      "value": 33.5,
      "unit": "s",
      "sample_count": 1,
      "missing_count": 0
    },
    {
      "name": "scene_pouch_at_end",
      "value": 1,
      "unit": "ratio",
      "sample_count": 1,
      "missing_count": 0
    },
    {
      "name": "scene_pick_in_slot",
      "value": 1,
      "unit": "ratio",
      "sample_count": 1,
      "missing_count": 0
    },
    {
      "name": "scene_delivered_docked",
      "value": 1,
      "unit": "ratio",
      "sample_count": 1,
      "missing_count": 0
    },
    {
      "name": "amr_touch_count",
      "value": 0,
      "unit": "count",
      "sample_count": 1,
      "missing_count": 0
    },
    {
      "name": "governor_margin_lines",
      "value": 84,
      "unit": "count",
      "sample_count": 1,
      "missing_count": 0
    },
    {
      "name": "governor_full_speed_lines",
      "value": 12,
      "unit": "count",
      "sample_count": 1,
      "missing_count": 0
    },
    {
      "name": "governor_unknown_lines",
      "value": 3,
      "unit": "count",
      "sample_count": 1,
      "missing_count": 0
    },
    {
      "name": "boot_check_pass",
      "value": 1,
      "unit": "ratio",
      "sample_count": 1,
      "missing_count": 0
    },
    {
      "name": "orders10_delivered",
      "value": null,
      "unit": "count",
      "sample_count": 0,
      "missing_count": 1
    },
    {
      "name": "orders_beds_all_delivered",
      "value": null,
      "unit": "count",
      "sample_count": 0,
      "missing_count": 1
    },
    {
      "name": "orders10_multipc_delivered",
      "value": null,
      "unit": "count",
      "sample_count": 0,
      "missing_count": 1
    },
    {
      "name": "record_fps_min",
      "value": 30.0,
      "unit": "fps",
      "sample_count": 1,
      "missing_count": 0
    },
    {
      "name": "record_drop_ratio_max",
      "value": 0.0,
      "unit": "ratio",
      "sample_count": 1,
      "missing_count": 0
    },
    {
      "name": "record_corrupt_sum",
      "value": 0,
      "unit": "count",
      "sample_count": 1,
      "missing_count": 0
    },
    {
      "name": "unplanned_intervention_count",
      "value": 0,
      "unit": "count",
      "sample_count": 1,
      "missing_count": 0
    },
    {
      "name": "avoidance_encounters",
      "value": 4,
      "unit": "count",
      "sample_count": 1,
      "missing_count": 0
    },
    {
      "name": "governor_limit_lines_during_encounters",
      "value": 12,
      "unit": "count",
      "sample_count": 1,
      "missing_count": 0
    },
    {
      "name": "vision_detect_rate",
      "value": 1.0,
      "unit": "ratio",
      "sample_count": 1,
      "missing_count": 0
    },
    {
      "name": "vision_latency_ms",
      "value": 0.0,
      "unit": "ms",
      "sample_count": 1,
      "missing_count": 0
    },
    {
      "name": "fresh_clone_step_wall_s",
      "value": null,
      "unit": "s",
      "sample_count": 0,
      "missing_count": 1
    },
    {
      "name": "fresh_clone_asset_sha_ok",
      "value": null,
      "unit": "ratio",
      "sample_count": 0,
      "missing_count": 1
    },
    {
      "name": "rtf",
      "value": 0.572,
      "unit": "ratio",
      "sample_count": 1,
      "missing_count": 0
    },
    {
      "name": "attempt_wall_s",
      "value": 549.039,
      "unit": "s",
      "sample_count": 1,
      "missing_count": 0
    },
    {
      "name": "reset_dock_pose_error_m",
      "value": null,
      "unit": "m",
      "sample_count": 0,
      "missing_count": 1
    },
    {
      "name": "reset_arm_park_error_rad",
      "value": null,
      "unit": "rad",
      "sample_count": 0,
      "missing_count": 1
    },
    {
      "name": "pouch_spawn_records",
      "value": 1,
      "unit": "count",
      "sample_count": 1,
      "missing_count": 0
    }
  ],
  "notes": "campaign 3 · attempt 2 · 원문 #240 5847905562. 원본은 master01 /home/rokey/markle_tmp/m1-camp3-a02-bed_a1-a4b1a4e-138 다. 폴더 SHA256SUMS 전문의 sha256 은 6dec026c6a4fa25557569c3fa9c1e09dc390c7a4b333635230b0c2493bef6b79 다. artifacts 에는 크기(ls -l)와 전체 sha256 이 함께 보고된 파일만 넣었다. config 지문은 deployment.json, scene 지문은 sim/scenes/hospital_navigationv1.usda 다. metrics 는 tools/aggregate_runs.py --attempt 2 --json 출력(보고 본문 첨부)을 그대로 옮겼다. "
}
