{
  "schema_version": 1,
  "run_id": "20260927T061100Z-master02-624c0f8c",
  "created_at": "2026-09-27T06:11:00Z",
  "code": {
    "commit": "a4b1a4e8f1b27dfb8c107967c138942f1b1e6dc6",
    "dirty": false
  },
  "host_id": "master02",
  "environment": {
    "versions": {
      "os": "Ubuntu 24.04.4 LTS kernel 6.14.0-27-generic",
      "ros": "jazzy",
      "isaac_sim": "5.1.0-rc.19+release.26219.9c81211b.gl",
      "rmw": "rmw_fastrtps_cpp",
      "gpu_driver": "580.173.02",
      "cuda": "13.0"
    },
    "fingerprints": {
      "config": {
        "sha256": "edcf16c1551cb877ab2ab39c5e842a473deed7e8e8fb6875f1ad41ff556c79b4"
      },
      "scene": {
        "sha256": "ce4c955d7cb061a11791b9aab57eb836d75d5a3adfdf86b485b5fccca1a1e100"
      },
      "model": {
        "not_applicable": "학습 모델을 쓰지 않았다. 판독은 OpenCV QR, 집기 좌표는 시뮬 센서다."
      },
      "dataset": {
        "not_applicable": "학습 · 평가 데이터셋을 쓰지 않았다."
      }
    }
  },
  "clocks": {
    "duration": "simulation",
    "timeout": "monotonic"
  },
  "seed": 7,
  "repetition_index": 12,
  "protocol": {
    "path": "experiments/protocols/hospital-full-acceptance-v2.json",
    "sha256": "5d2d9478b707fdfd4d3c1462684696755e9b1bbd1586066bfd683908efe61426"
  },
  "phase": "acceptance",
  "outcome": "failed",
  "artifacts": [
    {
      "uri": "sha256/59c46dd2da39aca9f8e2001109a90af209d528413aa65ab93315728038b77477/env.sh",
      "sha256": "59c46dd2da39aca9f8e2001109a90af209d528413aa65ab93315728038b77477",
      "size_bytes": 1451
    },
    {
      "uri": "sha256/2038543caddb5afca0b091d0fafdc0b5bf542fdb55a5a6f9b072a51b4096d502/up.console",
      "sha256": "2038543caddb5afca0b091d0fafdc0b5bf542fdb55a5a6f9b072a51b4096d502",
      "size_bytes": 2422
    },
    {
      "uri": "sha256/8199c512c899ea17170b7010c848ed3d8e9dbdfccb00ddf2b64613fd3791fda0/clip-1.mkv",
      "sha256": "8199c512c899ea17170b7010c848ed3d8e9dbdfccb00ddf2b64613fd3791fda0",
      "size_bytes": 94226648
    },
    {
      "uri": "sha256/96c828e9f580b1a7f7ba94fa728fde40cd01b23617f70b359a4084ff743a9877/gpu.csv",
      "sha256": "96c828e9f580b1a7f7ba94fa728fde40cd01b23617f70b359a4084ff743a9877",
      "size_bytes": 560
    },
    {
      "uri": "sha256/955d4452cf9b6e345346299b5fa3ce5e57b4a28c059816a9f62e4ae50f7dd4ce/top.txt",
      "sha256": "955d4452cf9b6e345346299b5fa3ce5e57b4a28c059816a9f62e4ae50f7dd4ce",
      "size_bytes": 42252
    },
    {
      "uri": "sha256/dfc07233fbc7406b389b9da5b9112dc1fe147f6ae2a988b7e39f1f7e4426d540/events.log",
      "sha256": "dfc07233fbc7406b389b9da5b9112dc1fe147f6ae2a988b7e39f1f7e4426d540",
      "size_bytes": 727
    },
    {
      "uri": "sha256/e385618293485968eff22e82baaf8fe88e60e614da8316b3dff58963a39731bf/logs/20260927-150221-arm.log",
      "sha256": "e385618293485968eff22e82baaf8fe88e60e614da8316b3dff58963a39731bf",
      "size_bytes": 6216
    },
    {
      "uri": "sha256/dc1d5b19cfa498f21898283043ebe03014d10aca514a944eca1a94b390ba5a62/logs/20260927-150221-nav.log",
      "sha256": "dc1d5b19cfa498f21898283043ebe03014d10aca514a944eca1a94b390ba5a62",
      "size_bytes": 60153
    },
    {
      "uri": "sha256/a6b50e8f10a4038902765555b4dac4e198db32008a2539d45f00c50f6bf8ad12/logs/20260927-150221-stack.log",
      "sha256": "a6b50e8f10a4038902765555b4dac4e198db32008a2539d45f00c50f6bf8ad12",
      "size_bytes": 22162
    },
    {
      "uri": "sha256/76990c28381c5909ed3285dae5c415a52cf0b1d7cfdfe15f9dc2de5ebec32657/logs/20260927-150221-tree.txt",
      "sha256": "76990c28381c5909ed3285dae5c415a52cf0b1d7cfdfe15f9dc2de5ebec32657",
      "size_bytes": 125
    },
    {
      "uri": "sha256/35ce37a794e07a343bd815e607602ec0ac33dd93529088471536a1b2c3414598/logs/20260927-150221-web.log",
      "sha256": "35ce37a794e07a343bd815e607602ec0ac33dd93529088471536a1b2c3414598",
      "size_bytes": 59708
    }
  ],
  "metrics": [
    {
      "name": "attempt_success",
      "value": 0,
      "unit": "ratio",
      "sample_count": 1,
      "missing_count": 0
    },
    {
      "name": "scene_workcell_ready",
      "value": 1,
      "unit": "ratio",
      "sample_count": 1,
      "missing_count": 0
    },
    {
      "name": "scene_refill_both",
      "value": 1,
      "unit": "ratio",
      "sample_count": 1,
      "missing_count": 0
    },
    {
      "name": "scene_container_qr",
      "value": 1,
      "unit": "ratio",
      "sample_count": 1,
      "missing_count": 0
    },
    {
      "name": "pouch_to_end_s",
      "value": 33.5,
      "unit": "s",
      "sample_count": 1,
      "missing_count": 0
    },
    {
      "name": "scene_pouch_at_end",
      "value": 1,
      "unit": "ratio",
      "sample_count": 1,
      "missing_count": 0
    },
    {
      "name": "scene_pick_in_slot",
      "value": 1,
      "unit": "ratio",
      "sample_count": 1,
      "missing_count": 0
    },
    {
      "name": "scene_delivered_docked",
      "value": 1,
      "unit": "ratio",
      "sample_count": 1,
      "missing_count": 0
    },
    {
      "name": "amr_touch_count",
      "value": 0,
      "unit": "count",
      "sample_count": 1,
      "missing_count": 0
    },
    {
      "name": "governor_margin_lines",
      "value": 71,
      "unit": "count",
      "sample_count": 1,
      "missing_count": 0
    },
    {
      "name": "governor_full_speed_lines",
      "value": 10,
      "unit": "count",
      "sample_count": 1,
      "missing_count": 0
    },
    {
      "name": "governor_unknown_lines",
      "value": 4,
      "unit": "count",
      "sample_count": 1,
      "missing_count": 0
    },
    {
      "name": "boot_check_pass",
      "value": 0,
      "unit": "ratio",
      "sample_count": 1,
      "missing_count": 0
    },
    {
      "name": "orders10_delivered",
      "value": null,
      "unit": "count",
      "sample_count": 0,
      "missing_count": 1
    },
    {
      "name": "orders_beds_all_delivered",
      "value": null,
      "unit": "count",
      "sample_count": 0,
      "missing_count": 1
    },
    {
      "name": "orders10_multipc_delivered",
      "value": null,
      "unit": "count",
      "sample_count": 0,
      "missing_count": 1
    },
    {
      "name": "record_fps_min",
      "value": 30.0,
      "unit": "fps",
      "sample_count": 1,
      "missing_count": 0
    },
    {
      "name": "record_drop_ratio_max",
      "value": 0.0,
      "unit": "ratio",
      "sample_count": 1,
      "missing_count": 0
    },
    {
      "name": "record_corrupt_sum",
      "value": 0,
      "unit": "count",
      "sample_count": 1,
      "missing_count": 0
    },
    {
      "name": "unplanned_intervention_count",
      "value": 0,
      "unit": "count",
      "sample_count": 1,
      "missing_count": 0
    },
    {
      "name": "avoidance_encounters",
      "value": 2,
      "unit": "count",
      "sample_count": 1,
      "missing_count": 0
    },
    {
      "name": "governor_limit_lines_during_encounters",
      "value": null,
      "unit": "count",
      "sample_count": 0,
      "missing_count": 1
    },
    {
      "name": "vision_detect_rate",
      "value": 1.0,
      "unit": "ratio",
      "sample_count": 1,
      "missing_count": 0
    },
    {
      "name": "vision_latency_ms",
      "value": 0.0,
      "unit": "ms",
      "sample_count": 1,
      "missing_count": 0
    },
    {
      "name": "fresh_clone_step_wall_s",
      "value": null,
      "unit": "s",
      "sample_count": 0,
      "missing_count": 1
    },
    {
      "name": "fresh_clone_asset_sha_ok",
      "value": null,
      "unit": "ratio",
      "sample_count": 0,
      "missing_count": 1
    },
    {
      "name": "rtf",
      "value": null,
      "unit": "ratio",
      "sample_count": 0,
      "missing_count": 1
    },
    {
      "name": "attempt_wall_s",
      "value": null,
      "unit": "s",
      "sample_count": 0,
      "missing_count": 1
    },
    {
      "name": "reset_dock_pose_error_m",
      "value": null,
      "unit": "m",
      "sample_count": 0,
      "missing_count": 1
    },
    {
      "name": "reset_arm_park_error_rad",
      "value": null,
      "unit": "rad",
      "sample_count": 0,
      "missing_count": 1
    },
    {
      "name": "pouch_spawn_records",
      "value": 1,
      "unit": "count",
      "sample_count": 1,
      "missing_count": 0
    }
  ],
  "notes": "campaign 3 · attempt 12 · phase E 다중 PC(master01 stage + master02 arm·nav·stack·web) · protocol v2 · 원문 #240 5854055865, 5853263554, 5853273050, 5853833466, 5854056297, 5854058748. 원본은 master02 ~/markle_tmp/m2-c3-a12v4-mp1-a4b1a4e 다(호스트 IsaacSim07). SHA256SUMS 파일의 sha256 은 59deebbba6ad5fba9cc486b802d66119438f709e2bc464ec60e0c1c7f9cac759 다. artifacts 에는 크기(ls -l)와 전체 sha256 이 함께 보고된 파일만 넣었다. config 지문은 release 트리의 deployment.json, scene 지문은 master02 워크셀 준비 base.usda 다. created_at 은 ls 의 분 단위 시각(SHA256SUMS 15:11 KST)에서 초를 0 으로 둔 값이다. 녹화는 웹 창을 포함한 전체 화면 1파일이다. metrics 는 최적화가 #746 도구(361f817)로 master01(stage, m1-camp3-a12-mp1-a4b1a4e-r145748)과 master02 두 폴더를 --run 두 번 · --attempt 12 · protocol v2 로 재합산한 --json 출력(#240 5854055865)이다. 도구 361f817 재합산, stage host boot_check 미실행 — boot_check_pass 0 은 stage 를 맡은 master01 에 boot_check 파일이 없고(#240 5854056297) master02 는 viewport SKIP 이라 어느 host 에서도 viewport PASS 가 없다는 도구 규칙의 결과다. 앞선 main 3a5b822 도구 합산(#240 5853833466)은 agg/ 링크가 풀린 위치에서 깨져 장면 지표를 비워 냈고, 이 파일은 그 값을 쓰지 않는다. host_id 는 c2 12·13 · c3 13 처럼 master02 로 두고 artifacts · 지문 · created_at 은 master02 폴더 기준이다. orders10_* 3개가 record_missing 인 것은 attempt 12 가 설계상 hospital_orders 를 쓰지 않고 curl 단일 요청으로 주문했기 때문이다(#240 5854058748 원문 ③) — 1건 attempt 라 해당 metric 이 원래 없다. 실패 사유(원문): reason=operator — stage 를 맡은 master01 에서 boot_check 를 실행하지 않았다(#240 5854056297 원문: \"up.log 에 [boot_check] 관련 줄이 아예 없어서 애초에 안 돌았음\"). protocol v2 4(c) 는 stage host 의 viewport 를 뺄 수 없으므로 boot_check 게이트가 성립하지 않는다. 배송 · 도킹 자체는 master02 쪽에서 delivered_docked 1(#240 5853263554). 작전 결정: 미실행이면 FAIL(operator) 등록 + 재실행. 실패 기록: failure_class=operator · 원인: stage 를 맡은 master01 에서 boot_check 미실행 · 근거: #240 5854056297 · 재시도 run: 없음(재실행 취소, 재범 결정 안 2)."
}
