{
  "schema_version": 1,
  "run_id": "20260927T003000Z-master02-a872dfa4",
  "created_at": "2026-09-27T00:30:00Z",
  "code": {
    "commit": "a4b1a4e8f1b27dfb8c107967c138942f1b1e6dc6",
    "dirty": false
  },
  "host_id": "master02",
  "environment": {
    "versions": {
      "os": "Ubuntu 24.04.4 LTS kernel 6.14.0-27-generic",
      "ros": "jazzy",
      "isaac_sim": "5.1.0-rc.19+release.26219.9c81211b.gl",
      "rmw": "rmw_fastrtps_cpp",
      "gpu_driver": "580.173.02",
      "cuda": "13.0"
    },
    "fingerprints": {
      "config": {
        "sha256": "edcf16c1551cb877ab2ab39c5e842a473deed7e8e8fb6875f1ad41ff556c79b4"
      },
      "scene": {
        "sha256": "ce4c955d7cb061a11791b9aab57eb836d75d5a3adfdf86b485b5fccca1a1e100"
      },
      "model": {
        "not_applicable": "학습 모델을 쓰지 않았다. 판독은 OpenCV QR, 집기 좌표는 시뮬 센서다."
      },
      "dataset": {
        "not_applicable": "학습 · 평가 데이터셋을 쓰지 않았다."
      }
    }
  },
  "clocks": {
    "duration": "simulation",
    "timeout": "monotonic"
  },
  "seed": 7,
  "repetition_index": 6,
  "protocol": {
    "path": "experiments/protocols/hospital-full-acceptance-v1.json",
    "sha256": "6cbd564a73388ba930ba3f72a38470e16ba4cf7a65eefde0b15f4af8854b286a"
  },
  "phase": "acceptance",
  "outcome": "succeeded",
  "artifacts": [
    {
      "uri": "sha256/f3e28702477deb3e49e8bb3eac2a174b834b25d94698fb71b6298ac721b457bf/env.sh",
      "sha256": "f3e28702477deb3e49e8bb3eac2a174b834b25d94698fb71b6298ac721b457bf",
      "size_bytes": 1455
    },
    {
      "uri": "sha256/28b63a081770436f95d3f07c5766a5d276dc2d71a7dedf3f851a04bd0a1fec1f/up.console",
      "sha256": "28b63a081770436f95d3f07c5766a5d276dc2d71a7dedf3f851a04bd0a1fec1f",
      "size_bytes": 2421
    },
    {
      "uri": "sha256/2335d7699903fa8c716ef191bff4cf7f5331689cb0693e1de5f063c244f5d52d/orders.log",
      "sha256": "2335d7699903fa8c716ef191bff4cf7f5331689cb0693e1de5f063c244f5d52d",
      "size_bytes": 1585
    },
    {
      "uri": "sha256/897a75714928d649bd54da53735b4aee0a4c7ac1c46e6464b242cf1a76223bc4/dryrun.log",
      "sha256": "897a75714928d649bd54da53735b4aee0a4c7ac1c46e6464b242cf1a76223bc4",
      "size_bytes": 558
    },
    {
      "uri": "sha256/d787c7cb5b7098881b5d1cc6ce12763a984c2e3aa640c01540841309a0d8112d/clip-1.mkv",
      "sha256": "d787c7cb5b7098881b5d1cc6ce12763a984c2e3aa640c01540841309a0d8112d",
      "size_bytes": 1113220128
    },
    {
      "uri": "sha256/58d79ae6e8ee6a15d01c381d5476ab6ad2151c76f4e81724a96dbaedfaf7908b/gpu.csv",
      "sha256": "58d79ae6e8ee6a15d01c381d5476ab6ad2151c76f4e81724a96dbaedfaf7908b",
      "size_bytes": 469939
    },
    {
      "uri": "sha256/7e9689fd336fe129a9140747c4f1de74bee62155c696be3a1e9362ce07f1f90f/top.txt",
      "sha256": "7e9689fd336fe129a9140747c4f1de74bee62155c696be3a1e9362ce07f1f90f",
      "size_bytes": 54656277
    },
    {
      "uri": "sha256/50528034d7953d93e4f56129d866f15496eee49aab156e915345c88a9c17442c/logs/20260927-075640-arm.log",
      "sha256": "50528034d7953d93e4f56129d866f15496eee49aab156e915345c88a9c17442c",
      "size_bytes": 18642
    },
    {
      "uri": "sha256/3c1839c5d9e6b94cfcc30b0eef2ef8e04ddd71324a05fbc9287e8d9840d08c7e/logs/20260927-075640-kit.log",
      "sha256": "3c1839c5d9e6b94cfcc30b0eef2ef8e04ddd71324a05fbc9287e8d9840d08c7e",
      "size_bytes": 18140434
    },
    {
      "uri": "sha256/73d138ace2b26faa134d02347db69d9f2db42716eb6b00d731306b833f8f0e67/logs/20260927-075640-nav.log",
      "sha256": "73d138ace2b26faa134d02347db69d9f2db42716eb6b00d731306b833f8f0e67",
      "size_bytes": 383257
    },
    {
      "uri": "sha256/aed8d0d5e38365533d0c2820ba18c2f6141ea6689832ffb79d7ee98037da56b5/logs/20260927-075640-stack.log",
      "sha256": "aed8d0d5e38365533d0c2820ba18c2f6141ea6689832ffb79d7ee98037da56b5",
      "size_bytes": 113023
    },
    {
      "uri": "sha256/f0307bccf70f7ed55ce0fe4f5b4825159903c08ae77ad30a4ceb0e750d9f4371/logs/20260927-075640-stage.log",
      "sha256": "f0307bccf70f7ed55ce0fe4f5b4825159903c08ae77ad30a4ceb0e750d9f4371",
      "size_bytes": 1854447
    },
    {
      "uri": "sha256/76990c28381c5909ed3285dae5c415a52cf0b1d7cfdfe15f9dc2de5ebec32657/logs/20260927-075640-tree.txt",
      "sha256": "76990c28381c5909ed3285dae5c415a52cf0b1d7cfdfe15f9dc2de5ebec32657",
      "size_bytes": 125
    },
    {
      "uri": "sha256/b6eda6df418a742a823625ddd7afb895a9af5a0b0c6226ace40c89f746a1a99f/logs/20260927-075640-web.log",
      "sha256": "b6eda6df418a742a823625ddd7afb895a9af5a0b0c6226ace40c89f746a1a99f",
      "size_bytes": 1190614
    }
  ],
  "metrics": [
    {
      "name": "attempt_success",
      "value": 1,
      "unit": "ratio",
      "sample_count": 1,
      "missing_count": 0
    },
    {
      "name": "scene_workcell_ready",
      "value": 1,
      "unit": "ratio",
      "sample_count": 1,
      "missing_count": 0
    },
    {
      "name": "scene_refill_both",
      "value": 1,
      "unit": "ratio",
      "sample_count": 1,
      "missing_count": 0
    },
    {
      "name": "scene_container_qr",
      "value": 1,
      "unit": "ratio",
      "sample_count": 1,
      "missing_count": 0
    },
    {
      "name": "pouch_to_end_s",
      "value": 33.5,
      "unit": "s",
      "sample_count": 1,
      "missing_count": 0
    },
    {
      "name": "scene_pouch_at_end",
      "value": 1,
      "unit": "ratio",
      "sample_count": 1,
      "missing_count": 0
    },
    {
      "name": "scene_pick_in_slot",
      "value": 1,
      "unit": "ratio",
      "sample_count": 1,
      "missing_count": 0
    },
    {
      "name": "scene_delivered_docked",
      "value": 1,
      "unit": "ratio",
      "sample_count": 1,
      "missing_count": 0
    },
    {
      "name": "amr_touch_count",
      "value": 0,
      "unit": "count",
      "sample_count": 1,
      "missing_count": 0
    },
    {
      "name": "governor_margin_lines",
      "value": 686,
      "unit": "count",
      "sample_count": 1,
      "missing_count": 0
    },
    {
      "name": "governor_full_speed_lines",
      "value": 84,
      "unit": "count",
      "sample_count": 1,
      "missing_count": 0
    },
    {
      "name": "governor_unknown_lines",
      "value": 18,
      "unit": "count",
      "sample_count": 1,
      "missing_count": 0
    },
    {
      "name": "boot_check_pass",
      "value": 1,
      "unit": "ratio",
      "sample_count": 1,
      "missing_count": 0
    },
    {
      "name": "orders10_delivered",
      "value": 10,
      "unit": "count",
      "sample_count": 1,
      "missing_count": 0
    },
    {
      "name": "orders_beds_all_delivered",
      "value": null,
      "unit": "count",
      "sample_count": 0,
      "missing_count": 1
    },
    {
      "name": "orders10_multipc_delivered",
      "value": null,
      "unit": "count",
      "sample_count": 0,
      "missing_count": 1
    },
    {
      "name": "record_fps_min",
      "value": 30.0,
      "unit": "fps",
      "sample_count": 1,
      "missing_count": 0
    },
    {
      "name": "record_drop_ratio_max",
      "value": 0.0,
      "unit": "ratio",
      "sample_count": 1,
      "missing_count": 0
    },
    {
      "name": "record_corrupt_sum",
      "value": 0,
      "unit": "count",
      "sample_count": 1,
      "missing_count": 0
    },
    {
      "name": "unplanned_intervention_count",
      "value": 0,
      "unit": "count",
      "sample_count": 1,
      "missing_count": 0
    },
    {
      "name": "avoidance_encounters",
      "value": 28,
      "unit": "count",
      "sample_count": 1,
      "missing_count": 0
    },
    {
      "name": "governor_limit_lines_during_encounters",
      "value": 113,
      "unit": "count",
      "sample_count": 1,
      "missing_count": 0
    },
    {
      "name": "vision_detect_rate",
      "value": 1.0,
      "unit": "ratio",
      "sample_count": 1,
      "missing_count": 0
    },
    {
      "name": "vision_latency_ms",
      "value": 0.0,
      "unit": "ms",
      "sample_count": 1,
      "missing_count": 0
    },
    {
      "name": "fresh_clone_step_wall_s",
      "value": null,
      "unit": "s",
      "sample_count": 0,
      "missing_count": 1
    },
    {
      "name": "fresh_clone_asset_sha_ok",
      "value": null,
      "unit": "ratio",
      "sample_count": 0,
      "missing_count": 1
    },
    {
      "name": "rtf",
      "value": 0.401,
      "unit": "ratio",
      "sample_count": 1,
      "missing_count": 0
    },
    {
      "name": "attempt_wall_s",
      "value": 5617.397,
      "unit": "s",
      "sample_count": 1,
      "missing_count": 0
    },
    {
      "name": "reset_dock_pose_error_m",
      "value": null,
      "unit": "m",
      "sample_count": 0,
      "missing_count": 1
    },
    {
      "name": "reset_arm_park_error_rad",
      "value": null,
      "unit": "rad",
      "sample_count": 0,
      "missing_count": 1
    },
    {
      "name": "pouch_spawn_records",
      "value": 10,
      "unit": "count",
      "sample_count": 1,
      "missing_count": 0
    }
  ],
  "notes": "campaign 4 · attempt 6 · 원문 #240 5851795471. 원본은 master02 ~/markle_tmp/m2-c4-a06-ten-a4b1a4e 다(호스트 IsaacSim07). SHA256SUMS 파일의 sha256 은 7d983bddc361c7812fe052f4672edeed92211400290b1385db33d52262b9d3ae 다. artifacts 에는 크기(ls -l)와 전체 sha256 이 함께 보고된 파일만 넣었다. config 지문은 release 트리의 deployment.json, scene 지문은 master02 워크셀 준비 base.usda 다. created_at 은 ls 의 분 단위 시각(SHA256SUMS 09:30 KST)에서 초를 0 으로 둔 값이다. 녹화는 웹 창을 포함한 전체 화면 1파일이다. metrics 는 tools/aggregate_runs.py(#709 b38b74b) --attempt 6 --json 출력 그대로다. "
}
